{
  "$schema": "http://json-schema.org/draft-06/schema",
  "type": "object",
  "properties": {
    "version": {
      "type": "number"
    },
    "success": {
      "type": "boolean"
    },
    "reason": {},
    "content": {
      "type": "object",
      "properties": {
        "recordsTotal": {
          "type": "integer"
        },
        "recordsFiltered": {
          "type": "integer"
        },
        "data": {
          "type": "array",
          "items": {
            "type": "object",
            "properties": {
              "id": {
                "type": "integer"
              },
              "type": {
                "type": "string"
              },
              "value": {
                "type": "string"
              },
              "description": {},
              "attachment": {},
              "parent_id": {},
              "creator": {
                "type": "object",
                "properties": {
                  "id": {
                    "type": "integer"
                  },
                  "fname": {
                    "type": "string"
                  },
                  "lname": {
                    "type": "string"
                  },
                  "display_name": {
                    "type": "string"
                  },
                  "status": {
                    "type": "string"
                  },
                  "email": {
                    "type": "string"
                  },
                  "locked": {
                    "type": "boolean"
                  },
                  "password_changed": {
                    "type": "boolean"
                  },
                  "is_external": {
                    "type": "boolean"
                  },
                  "ui_theme": {
                    "type": "string"
                  },
                  "is_ldap": {
                    "type": "boolean"
                  },
                  "is_saml": {
                    "type": "boolean"
                  }
                }
              },
              "inc_id": {
                "type": "integer"
              },
              "inc_name": {
                "type": "string"
              },
              "inc_owner": {
                "type": "string"
              },
              "hits": {
                "type": "array"
              },
              "created": {
                "type": "integer"
              },
              "last_modified_time": {
                "type": "integer"
              },
              "last_modified_by": {
                "type": "object",
                "properties": {
                  "id": {
                    "type": "integer"
                  },
                  "type": {
                    "type": "string"
                  },
                  "name": {
                    "type": "string"
                  },
                  "display_name": {
                    "type": "string"
                  }
                }
              },
              "pending_sources": {
                "type": "array"
              },
              "perms": {
                "type": "object",
                "properties": {
                  "read": {
                    "type": "boolean"
                  },
                  "write": {
                    "type": "boolean"
                  },
                  "delete": {
                    "type": "boolean"
                  }
                }
              },
              "properties": {
                "type": "array",
                "items": {
                  "type": "object",
                  "properties": {
                    "name": {
                      "type": "string"
                    },
                    "value": {
                      "type": "string"
                    }
                  }
                }
              },
              "actions": {
                "type": "array",
                "items": {
                  "type": "object",
                  "properties": {
                    "id": {
                      "type": "integer"
                    },
                    "name": {
                      "type": "string"
                    },
                    "enabled": {
                      "type": "boolean"
                    }
                  }
                }
              },
              "playbooks": {
                "type": "array",
                "items": {
                  "type": "object",
                  "properties": {
                    "playbook_handle": {
                      "type": "string"
                    },
                    "display_name": {
                      "type": "string"
                    }
                  }
                }
              },
              "hash": {
                "type": "string"
              },
              "relating": {
                "type": "boolean"
              },
              "creator_principal": {
                "type": "object",
                "properties": {
                  "id": {
                    "type": "integer"
                  },
                  "type": {
                    "type": "string"
                  },
                  "name": {
                    "type": "string"
                  },
                  "display_name": {
                    "type": "string"
                  }
                }
              },
              "related_incident_count": {},
              "pending_scan_result": {
                "type": "boolean"
              },
              "global_info": {
                "type": "object",
                "properties": {
                  "id": {
                    "type": "integer"
                  },
                  "type": {
                    "type": "string"
                  },
                  "value": {
                    "type": "string"
                  },
                  "description": {},
                  "summary": {},
                  "creator": {
                    "type": "object",
                    "properties": {
                      "id": {
                        "type": "integer"
                      },
                      "type": {
                        "type": "string"
                      },
                      "name": {
                        "type": "string"
                      },
                      "display_name": {
                        "type": "string"
                      }
                    }
                  },
                  "created": {
                    "type": "integer"
                  },
                  "last_modified_by": {
                    "type": "object",
                    "properties": {
                      "id": {
                        "type": "integer"
                      },
                      "type": {
                        "type": "string"
                      },
                      "name": {
                        "type": "string"
                      },
                      "display_name": {
                        "type": "string"
                      }
                    }
                  },
                  "last_modified_time": {
                    "type": "integer"
                  },
                  "related_incident_count": {
                    "type": "integer"
                  },
                  "last_related_inc_id": {},
                  "last_related_inc_owner_handle": {},
                  "first_related_inc_id": {},
                  "first_related_inc_owner_handle": {},
                  "perms": {
                    "type": "object",
                    "properties": {
                      "write": {
                        "type": "boolean"
                      }
                    }
                  },
                  "first_associated_time": {
                    "type": "integer"
                  },
                  "last_associated_time": {
                    "type": "integer"
                  },
                  "properties": {},
                  "tags": {
                    "type": "array",
                    "items": {
                      "type": "object",
                      "properties": {
                        "tag_handle": {
                          "type": "string"
                        },
                        "value": {}
                      }
                    }
                  },
                  "version": {
                    "type": "integer"
                  },
                  "scan_option": {
                    "type": "string"
                  },
                  "relating_incidents": {
                    "type": "boolean"
                  },
                  "hit_threat_sources": {
                    "type": "array"
                  },
                  "relating": {
                    "type": "boolean"
                  },
                  "last_scan_hits": {
                    "type": "array"
                  }
                }
              },
              "ip": {
                "type": "object",
                "properties": {
                  "source": {
                    "type": "boolean"
                  },
                  "destination": {
                    "type": "boolean"
                  }
                }
              },
              "global_artifact": {
                "type": "array",
                "items": {
                  "type": "object",
                  "properties": {
                    "id": {
                      "type": "integer"
                    },
                    "type": {
                      "type": "string"
                    },
                    "value": {
                      "type": "string"
                    },
                    "description": {},
                    "summary": {},
                    "creator": {
                      "type": "object",
                      "properties": {
                        "id": {
                          "type": "integer"
                        },
                        "type": {
                          "type": "string"
                        },
                        "name": {
                          "type": "string"
                        },
                        "display_name": {
                          "type": "string"
                        }
                      }
                    },
                    "created": {
                      "type": "integer"
                    },
                    "last_modified_by": {
                      "type": "object",
                      "properties": {
                        "id": {
                          "type": "integer"
                        },
                        "type": {
                          "type": "string"
                        },
                        "name": {
                          "type": "string"
                        },
                        "display_name": {
                          "type": "string"
                        }
                      }
                    },
                    "last_modified_time": {
                      "type": "integer"
                    },
                    "related_incident_count": {
                      "type": "integer"
                    },
                    "last_related_inc_id": {},
                    "last_related_inc_owner_handle": {},
                    "first_related_inc_id": {},
                    "first_related_inc_owner_handle": {},
                    "perms": {
                      "type": "object",
                      "properties": {
                        "write": {
                          "type": "boolean"
                        }
                      }
                    },
                    "first_associated_time": {
                      "type": "integer"
                    },
                    "last_associated_time": {
                      "type": "integer"
                    },
                    "properties": {},
                    "tags": {
                      "type": "array",
                      "items": {
                        "type": "object",
                        "properties": {
                          "tag_handle": {
                            "type": "string"
                          },
                          "value": {}
                        }
                      }
                    },
                    "version": {
                      "type": "integer"
                    },
                    "scan_option": {
                      "type": "string"
                    },
                    "relating_incidents": {
                      "type": "boolean"
                    },
                    "hit_threat_sources": {
                      "type": "array"
                    },
                    "relating": {
                      "type": "boolean"
                    },
                    "last_scan_hits": {
                      "type": "array"
                    }
                  }
                }
              }
            }
          }
        }
      }
    },
    "raw": {},
    "inputs": {
      "type": "object",
      "properties": {
        "artifact_tag_values": {
          "type": "string"
        },
        "incident_id": {
          "type": "integer"
        },
        "artifact_type_values": {
          "type": "string"
        },
        "artifact_tag_method": {
          "type": "string"
        },
        "artifact_type_method": {
          "type": "string"
        },
        "artifact_include_incident_count": {
          "type": "boolean"
        },
        "artifact_value_method": {
          "type": "string"
        },
        "artifact_value": {
          "type": "string"
        }
      }
    },
    "metrics": {
      "type": "object",
      "properties": {
        "version": {
          "type": "string"
        },
        "package": {
          "type": "string"
        },
        "package_version": {
          "type": "string"
        },
        "host": {
          "type": "string"
        },
        "execution_time_ms": {
          "type": "integer"
        },
        "timestamp": {
          "type": "string"
        }
      }
    }
  }
}